{"$schema":"https://json-schema.org/draft/2020-12/schema","type":"object","additionalProperties":false,"required":["review_id","batches","system_two_ready_records","candidate_packets","verdict","plain_language","next_permitted_action"],"properties":{"review_id":{"type":"string","pattern":"^system-two-shadow-"},"batches":{"type":"array","minItems":2,"maxItems":2,"items":{"type":"string"}},"system_two_ready_records":{"type":"integer","minimum":0},"candidate_packets":{"type":"integer","minimum":0},"verdict":{"const":"LIMITED SUPPORT — NO TARGET TRIO"},"plain_language":{"type":"string","minLength":40},"next_permitted_action":{"type":"string","minLength":30}}}
